{
  "artifacts": [
    {
      "artifactID": "55555555-5555-4555-8555-555555555555",
      "commitSequence": 0,
      "equivalenceRule": "sameSourceAndResultHash",
      "expectedExistingPolicy": "absent",
      "expectedExistingSHA256": null,
      "journalFrontier": "attachmentVerified",
      "kind": "attachment",
      "logicalPath": [
        "Synthetic Vault",
        "Assets",
        "audio.wav"
      ],
      "mediaType": "audio/wav",
      "operationID": "77777777-7777-4777-8777-777777777777",
      "receiptKind": "attachmentCommit",
      "resultLength": 32,
      "resultSHA256": "1111111111111111111111111111111111111111111111111111111111111111",
      "sourceID": "66666666-6666-4666-8666-666666666666",
      "sourceLength": 32,
      "sourceMediaType": "audio/wav",
      "sourceSHA256": "1111111111111111111111111111111111111111111111111111111111111111"
    },
    {
      "artifactID": "88888888-8888-4888-8888-888888888888",
      "commitSequence": 1,
      "equivalenceRule": "exactBytes",
      "expectedExistingPolicy": "hashMatch",
      "expectedExistingSHA256": "2222222222222222222222222222222222222222222222222222222222222222",
      "expectedOriginalSHA256": "2222222222222222222222222222222222222222222222222222222222222222",
      "journalFrontier": "noteVerified",
      "kind": "note",
      "logicalPath": [
        "Synthetic Vault",
        "Inbox",
        "capture.md"
      ],
      "mediaType": "text/markdown; charset=utf-8",
      "operationID": "99999999-9999-4999-8999-999999999999",
      "preparedStreamID": "44444444-4444-4444-8444-444444444444",
      "receiptKind": "noteCommit",
      "resultLength": 25,
      "resultSHA256": "3333333333333333333333333333333333333333333333333333333333333333",
      "writeMode": "append"
    }
  ],
  "contractVersion": 1,
  "diagnostics": [
    {
      "code": "materialized",
      "fieldPath": "$",
      "severity": "info"
    }
  ],
  "operation": "existingNoteAppend",
  "pins": {
    "coreVersion": "vox-core-contract-only",
    "modelProfileID": null,
    "modelRevision": null,
    "profileID": "apple-parity-v1",
    "profileVersion": 1,
    "rendererRevision": "swift-legacy-m0"
  },
  "planHash": "0000000000000000000000000000000000000000000000000000000000000000",
  "preparedByteDelivery": {
    "finalJSONDuplicatesBytes": false,
    "maximumChunkBytes": 1048576,
    "mode": "drainedImmutableArtifacts"
  },
  "requestID": "11111111-1111-4111-8111-111111111111",
  "retryMarker": {
    "placement": "entrySuffixBeforeFinalNewline",
    "policy": "voxCaptureCommentV1",
    "syntax": "<!-- vox-capture:{lowercase-uuid} -->"
  },
  "warnings": []
}
